{
  "evidence_id": "E-001",
  "claim_tested": "Exit from Vendor A was rehearsed",
  "evidence_type": "interview representation",
  "verification_status": "Provisional",
  "applicable_service": "payments",
  "evidence_conversion_action": "Obtain drill record DR-2026-Q3; owner Head of Payments; by 31 October 2026"
}
